{
  "schemaVersion": "phase3-1.0",
  "objectiveId": "obj-bellhop-l4-stage3-live-2026-08-30-09",
  "approvalId": "ha-bellhop-l4-stage3-obj-2026-08-30-09",
  "projectId": "bellhop",
  "workstreamId": "bellhop-l4-stage3-09",
  "transactionId": "bellhop-l4-stage3-tx-2026-08-30-09",
  "summary": "Complete Bellhop Level 4 Stage 3 planet sequence and Star Beam gameplay on accepted Stage 2 foundation (level3/847ca2d64090aaeb94ca681b651a44062ab9f644). One Composer 2.5 Cursor worker only. No Stage 4+, no merge/deploy, no Radio changes, no premium Cursor models, no second worker.",
  "baseBranch": "level3",
  "expectedStartingSha": "847ca2d64090aaeb94ca681b651a44062ab9f644",
  "permittedWorkTypes": [
    "DESIGN",
    "IMPLEMENTATION",
    "VERIFICATION",
    "CLOSEOUT"
  ],
  "prohibitedScope": [
    "Stage 4",
    "Level 4 Stage 4",
    "Cheese Moon implementation beyond already-approved foreshadowing",
    "merge PR",
    "automatic merge",
    "production deploy",
    "automatic deployment",
    "broad unrelated flight retuning",
    "unrelated refactoring",
    "unrelated visual redesign",
    "Radio implementation changes",
    "specialist swarms",
    "API Parent",
    "Claude worker",
    "GPT worker inside Cursor",
    "Gemini worker",
    "Grok worker",
    "premium Cursor model",
    "second Cursor worker",
    "budget expansion"
  ],
  "humanGatedActions": [
    "MERGE_PR",
    "PRODUCTION_DEPLOY",
    "START_DEFERRED_WORK",
    "BUDGET_OVERRIDE",
    "MATERIAL_PRODUCT_REQUIREMENT_CHANGE",
    "SUBJECTIVE_PLAYTEST",
    "STAGE_4_SCOPE",
    "PREMIUM_MODEL_ESCALATION"
  ],
  "maxIterations": 6,
  "maxCursorAgents": 1,
  "maxRetriesPerLogicalStep": 0,
  "maxCursorUsageTokens": null,
  "maxEstimatedSpend": null,
  "stateRevisionBasis": 11,
  "createdAt": "2026-08-30T11:32:00.000Z",
  "expiresAt": null,
  "consumed": true,
  "accounting": {
    "iterationsUsed": 1,
    "cursorAgentsUsed": 1,
    "retriesUsed": 0,
    "cursorUsageTokensUsed": 7518957,
    "estimatedSpendUsed": 0
  }
}
